Frame 1: 40 bytes on wire (320 bits), 40 bytes captured (320 bits)
Internet Protocol Version 4, Src: 10.0.0.2, Dst: 10.0.0.1
Transmission Control Protocol, Src Port: 54321, Dst Port: 443, Seq: 0, Len: 0

Frame 2: 40 bytes on wire (320 bits), 40 bytes captured (320 bits)
Internet Protocol Version 4, Src: 10.0.0.1, Dst: 10.0.0.2
Transmission Control Protocol, Src Port: 443, Dst Port: 54321, Seq: 0, Ack: 1, Len: 0

Frame 3: 40 bytes on wire (320 bits), 40 bytes captured (320 bits)
Internet Protocol Version 4, Src: 10.0.0.2, Dst: 10.0.0.1
Transmission Control Protocol, Src Port: 54321, Dst Port: 443, Seq: 1, Ack: 1, Len: 0

Frame 4: 176 bytes on wire (1408 bits), 176 bytes captured (1408 bits)
Internet Protocol Version 4, Src: 10.0.0.2, Dst: 10.0.0.1
Transmission Control Protocol, Src Port: 54321, Dst Port: 443, Seq: 1, Ack: 1, Len: 136
Transport Layer Security
    TLSv1 Record Layer: Handshake Protocol: Client Hello
        Content Type: Handshake (22)
        Version: TLS 1.0 (0x0301)
        Length: 131
        Handshake Protocol: Client Hello
            Handshake Type: Client Hello (1)
            Length: 127
            Version: TLS 1.2 (0x0303)
            Random: aaf68a253f82f81daccfe0a24af3e3b948e2a50510bb21dea979bf74772966a8
                GMT Unix Time: Nov 21, 2060 17:32:21.000000000 UTC
                Random Bytes: 3f82f81daccfe0a24af3e3b948e2a50510bb21dea979bf74772966a8
            Session ID Length: 0
            Cipher Suites Length: 4
            Cipher Suites (2 suites)
                Cipher Suite: TLS_ECDHE_RSA_WITH_AES_128_GCM_SHA256 (0xc02f)
                Cipher Suite: TLS_EMPTY_RENEGOTIATION_INFO_SCSV (0x00ff)
            Compression Methods Length: 1
            Compression Methods (1 method)
                Compression Method: null (0)
            Extensions Length: 82
            Extension: ec_point_formats (len=4)
                Type: ec_point_formats (11)
                Length: 4
                EC point formats Length: 3
                Elliptic curves point formats (3)
                    EC point format: uncompressed (0)
                    EC point format: ansiX962_compressed_prime (1)
                    EC point format: ansiX962_compressed_char2 (2)
            Extension: supported_groups (len=12)
                Type: supported_groups (10)
                Length: 12
                Supported Groups List Length: 10
                Supported Groups (5 groups)
                    Supported Group: x25519 (0x001d)
                    Supported Group: secp256r1 (0x0017)
                    Supported Group: x448 (0x001e)
                    Supported Group: secp521r1 (0x0019)
                    Supported Group: secp384r1 (0x0018)
            Extension: session_ticket (len=0)
                Type: session_ticket (35)
                Length: 0
                Session Ticket: <MISSING>
            Extension: encrypt_then_mac (len=0)
                Type: encrypt_then_mac (22)
                Length: 0
            Extension: extended_master_secret (len=0)
                Type: extended_master_secret (23)
                Length: 0
            Extension: signature_algorithms (len=42)
                Type: signature_algorithms (13)
                Length: 42
                Signature Hash Algorithms Length: 40
                Signature Hash Algorithms (20 algorithms)
                    Signature Algorithm: ecdsa_secp256r1_sha256 (0x0403)
                        Signature Hash Algorithm Hash: SHA256 (4)
                        Signature Hash Algorithm Signature: ECDSA (3)
                    Signature Algorithm: ecdsa_secp384r1_sha384 (0x0503)
                        Signature Hash Algorithm Hash: SHA384 (5)
                        Signature Hash Algorithm Signature: ECDSA (3)
                    Signature Algorithm: ecdsa_secp521r1_sha512 (0x0603)
                        Signature Hash Algorithm Hash: SHA512 (6)
                        Signature Hash Algorithm Signature: ECDSA (3)
                    Signature Algorithm: ed25519 (0x0807)
                        Signature Hash Algorithm Hash: Unknown (8)
                        Signature Hash Algorithm Signature: Unknown (7)
                    Signature Algorithm: ed448 (0x0808)
                        Signature Hash Algorithm Hash: Unknown (8)
                        Signature Hash Algorithm Signature: Unknown (8)
                    Signature Algorithm: rsa_pss_pss_sha256 (0x0809)
                        Signature Hash Algorithm Hash: Unknown (8)
                        Signature Hash Algorithm Signature: Unknown (9)
                    Signature Algorithm: rsa_pss_pss_sha384 (0x080a)
                        Signature Hash Algorithm Hash: Unknown (8)
                        Signature Hash Algorithm Signature: Unknown (10)
                    Signature Algorithm: rsa_pss_pss_sha512 (0x080b)
                        Signature Hash Algorithm Hash: Unknown (8)
                        Signature Hash Algorithm Signature: Unknown (11)
                    Signature Algorithm: rsa_pss_rsae_sha256 (0x0804)
                        Signature Hash Algorithm Hash: Unknown (8)
                        Signature Hash Algorithm Signature: SM2 (4)
                    Signature Algorithm: rsa_pss_rsae_sha384 (0x0805)
                        Signature Hash Algorithm Hash: Unknown (8)
                        Signature Hash Algorithm Signature: Unknown (5)
                    Signature Algorithm: rsa_pss_rsae_sha512 (0x0806)
                        Signature Hash Algorithm Hash: Unknown (8)
                        Signature Hash Algorithm Signature: Unknown (6)
                    Signature Algorithm: rsa_pkcs1_sha256 (0x0401)
                        Signature Hash Algorithm Hash: SHA256 (4)
                        Signature Hash Algorithm Signature: RSA (1)
                    Signature Algorithm: rsa_pkcs1_sha384 (0x0501)
                        Signature Hash Algorithm Hash: SHA384 (5)
                        Signature Hash Algorithm Signature: RSA (1)
                    Signature Algorithm: rsa_pkcs1_sha512 (0x0601)
                        Signature Hash Algorithm Hash: SHA512 (6)
                        Signature Hash Algorithm Signature: RSA (1)
                    Signature Algorithm: SHA224 ECDSA (0x0303)
                        Signature Hash Algorithm Hash: SHA224 (3)
                        Signature Hash Algorithm Signature: ECDSA (3)
                    Signature Algorithm: SHA224 RSA (0x0301)
                        Signature Hash Algorithm Hash: SHA224 (3)
                        Signature Hash Algorithm Signature: RSA (1)
                    Signature Algorithm: SHA224 DSA (0x0302)
                        Signature Hash Algorithm Hash: SHA224 (3)
                        Signature Hash Algorithm Signature: DSA (2)
                    Signature Algorithm: SHA256 DSA (0x0402)
                        Signature Hash Algorithm Hash: SHA256 (4)
                        Signature Hash Algorithm Signature: DSA (2)
                    Signature Algorithm: SHA384 DSA (0x0502)
                        Signature Hash Algorithm Hash: SHA384 (5)
                        Signature Hash Algorithm Signature: DSA (2)
                    Signature Algorithm: SHA512 DSA (0x0602)
                        Signature Hash Algorithm Hash: SHA512 (6)
                        Signature Hash Algorithm Signature: DSA (2)
            [JA4: t12i020600_b06afd972a5c_e7e480e5a997]
            [JA4_r: t12i020600_00ff,c02f_000a,000b,000d,0016,0017,0023_0403,0503,0603,0807,0808,0809,080a,080b,0804,0805,0806,0401,0501,0601,0303,0301,0302,0402,0502,0602]
            [JA3 Fullstring: 771,49199-255,11-10-35-22-23-13,29-23-30-25-24,0-1-2]
            [JA3: a4d4d6b97e8699a7c441f0e5f8df7914]

Frame 5: 110 bytes on wire (880 bits), 110 bytes captured (880 bits)
Internet Protocol Version 4, Src: 10.0.0.1, Dst: 10.0.0.2
Transmission Control Protocol, Src Port: 443, Dst Port: 54321, Seq: 1, Ack: 137, Len: 70
Transport Layer Security
    TLSv1.2 Record Layer: Handshake Protocol: Server Hello
        Content Type: Handshake (22)
        Version: TLS 1.2 (0x0303)
        Length: 65
        Handshake Protocol: Server Hello
            Handshake Type: Server Hello (2)
            Length: 61
            Version: TLS 1.2 (0x0303)
            Random: 55d334741916cf3612f2145322a6afb44ebd78dd16d6ef629ce398f25ff74c0e
                GMT Unix Time: Aug 18, 2015 13:34:44.000000000 UTC
                Random Bytes: 1916cf3612f2145322a6afb44ebd78dd16d6ef629ce398f25ff74c0e
            Session ID Length: 0
            Cipher Suite: TLS_ECDHE_RSA_WITH_AES_128_GCM_SHA256 (0xc02f)
            Compression Method: null (0)
            Extensions Length: 21
            Extension: renegotiation_info (len=1)
                Type: renegotiation_info (65281)
                Length: 1
                Renegotiation Info extension
                    Renegotiation info extension length: 0
            Extension: ec_point_formats (len=4)
                Type: ec_point_formats (11)
                Length: 4
                EC point formats Length: 3
                Elliptic curves point formats (3)
                    EC point format: uncompressed (0)
                    EC point format: ansiX962_compressed_prime (1)
                    EC point format: ansiX962_compressed_char2 (2)
            Extension: session_ticket (len=0)
                Type: session_ticket (35)
                Length: 0
                Session Ticket: <MISSING>
            Extension: extended_master_secret (len=0)
                Type: extended_master_secret (23)
                Length: 0
            [JA3S Fullstring: 771,49199,65281-11-35-23]
            [JA3S: 1af33e1657631357c73119488045302c]

Frame 6: 836 bytes on wire (6688 bits), 836 bytes captured (6688 bits)
Internet Protocol Version 4, Src: 10.0.0.1, Dst: 10.0.0.2
Transmission Control Protocol, Src Port: 443, Dst Port: 54321, Seq: 71, Ack: 137, Len: 796
Transport Layer Security
    TLSv1.2 Record Layer: Handshake Protocol: Certificate
        Content Type: Handshake (22)
        Version: TLS 1.2 (0x0303)
        Length: 791
        Handshake Protocol: Certificate
            Handshake Type: Certificate (11)
            Length: 787
            Certificates Length: 784
            Certificates (784 bytes)
                Certificate Length: 781
                Certificate [truncated]: 30820309308201f1a0030201020214126550c1847774c8bf8816a46736ef351da29e30300d06092a864886f70d01010b050030143112301006035504030c096c6f63616c686f7374301e170d3236303331383038343131385a170d3237303331383038343131385a301431
                    signedCertificate
                        version: v3 (2)
                        serialNumber: 0x126550c1847774c8bf8816a46736ef351da29e30
                        signature (sha256WithRSAEncryption)
                            Algorithm Id: 1.2.840.113549.1.1.11 (sha256WithRSAEncryption)
                        issuer: rdnSequence (0)
                            rdnSequence: 1 item (id-at-commonName=localhost)
                                RDNSequence item: 1 item (id-at-commonName=localhost)
                                    RelativeDistinguishedName item (id-at-commonName=localhost)
                                        Object Id: 2.5.4.3 (id-at-commonName)
                                        DirectoryString: uTF8String (4)
                                            uTF8String: localhost
                        validity
                            notBefore: utcTime (0)
                                utcTime: 2026-03-18 08:41:18 (UTC)
                            notAfter: utcTime (0)
                                utcTime: 2027-03-18 08:41:18 (UTC)
                        subject: rdnSequence (0)
                            rdnSequence: 1 item (id-at-commonName=localhost)
                                RDNSequence item: 1 item (id-at-commonName=localhost)
                                    RelativeDistinguishedName item (id-at-commonName=localhost)
                                        Object Id: 2.5.4.3 (id-at-commonName)
                                        DirectoryString: uTF8String (4)
                                            uTF8String: localhost
                        subjectPublicKeyInfo
                            algorithm (rsaEncryption)
                                Algorithm Id: 1.2.840.113549.1.1.1 (rsaEncryption)
                            subjectPublicKey [truncated]: 3082010a0282010100b78f759b2adf64bba7e0fc43480d8550249a18e3eb9cb05c21ad5143be0407735fc0abb7706f33da6a0a53962fd6e7e425f82099c97040dacab08eab7fe76f21d88d3f6ad2e0e7b6ef7e44c8f2e09d248b5f6c950e2c43c9d54233e28784a76
                                modulus: 0x00b78f759b2adf64bba7e0fc43480d8550249a18e3eb9cb05c21ad5143be0407735fc0ab…
                                publicExponent: 65537
                        extensions: 3 items
                            Extension (id-ce-subjectKeyIdentifier)
                                Extension Id: 2.5.29.14 (id-ce-subjectKeyIdentifier)
                                SubjectKeyIdentifier: d08977a8e709d29b57923a0f45d7e8d073584a35
                            Extension (id-ce-authorityKeyIdentifier)
                                Extension Id: 2.5.29.35 (id-ce-authorityKeyIdentifier)
                                AuthorityKeyIdentifier
                                    keyIdentifier: d08977a8e709d29b57923a0f45d7e8d073584a35
                            Extension (id-ce-basicConstraints)
                                Extension Id: 2.5.29.19 (id-ce-basicConstraints)
                                critical: True
                                BasicConstraintsSyntax
                                    cA: True
                    algorithmIdentifier (sha256WithRSAEncryption)
                        Algorithm Id: 1.2.840.113549.1.1.11 (sha256WithRSAEncryption)
                    Padding: 0
                    encrypted [truncated]: 98a7747c3cdc45414979ab92392a0a15460afc63fcb4cddd7fe90a1656689febd37a5f60609a1d9a56383cf4932f999acec1fcc3fadeb1cc1f3b157920f2415d988174ec2949de17db8daaebf568d42fff1e619e78861a4a88dc1ec342da7b7d531ab9b1aa0853fefed54f4c

Frame 7: 345 bytes on wire (2760 bits), 345 bytes captured (2760 bits)
Internet Protocol Version 4, Src: 10.0.0.1, Dst: 10.0.0.2
Transmission Control Protocol, Src Port: 443, Dst Port: 54321, Seq: 867, Ack: 137, Len: 305
Transport Layer Security
    TLSv1.2 Record Layer: Handshake Protocol: Server Key Exchange
        Content Type: Handshake (22)
        Version: TLS 1.2 (0x0303)
        Length: 300
        Handshake Protocol: Server Key Exchange
            Handshake Type: Server Key Exchange (12)
            Length: 296
            EC Diffie-Hellman Server Params
                Curve Type: named_curve (0x03)
                Named Curve: x25519 (0x001d)
                Pubkey Length: 32
                Pubkey: 70ad9d878113458c429c76a68b8670fac5735428e13f84432d396eb53fd8d447
                Signature Algorithm: rsa_pss_rsae_sha256 (0x0804)
                    Signature Hash Algorithm Hash: Unknown (8)
                    Signature Hash Algorithm Signature: SM2 (4)
                Signature Length: 256
                Signature [truncated]: 3a295ec00725b17cb01eb8b315bd4c235b3334a42940b8c0e78aa0004f3affcbbc2e28aad3f58e0f52e7188bc7ed60aa51f6cfa0a5571a1857c3a2b804a0f7733b5635ffbd2a304fdde2502761523c3cb0806061f954d104d73330d67b6fa20c469d98c6c05af7501d488892

Frame 8: 49 bytes on wire (392 bits), 49 bytes captured (392 bits)
Internet Protocol Version 4, Src: 10.0.0.1, Dst: 10.0.0.2
Transmission Control Protocol, Src Port: 443, Dst Port: 54321, Seq: 1172, Ack: 137, Len: 9
Transport Layer Security
    TLSv1.2 Record Layer: Handshake Protocol: Server Hello Done
        Content Type: Handshake (22)
        Version: TLS 1.2 (0x0303)
        Length: 4
        Handshake Protocol: Server Hello Done
            Handshake Type: Server Hello Done (14)
            Length: 0

Frame 9: 82 bytes on wire (656 bits), 82 bytes captured (656 bits)
Internet Protocol Version 4, Src: 10.0.0.2, Dst: 10.0.0.1
Transmission Control Protocol, Src Port: 54321, Dst Port: 443, Seq: 137, Ack: 1181, Len: 42
Transport Layer Security
    TLSv1.2 Record Layer: Handshake Protocol: Client Key Exchange
        Content Type: Handshake (22)
        Version: TLS 1.2 (0x0303)
        Length: 37
        Handshake Protocol: Client Key Exchange
            Handshake Type: Client Key Exchange (16)
            Length: 33
            EC Diffie-Hellman Client Params
                Pubkey Length: 32
                Pubkey: 71a9c1487c71644a472b5771c64ba82db57ee90ab2e4b3c5b9bf7da2bcccef1d

Frame 10: 46 bytes on wire (368 bits), 46 bytes captured (368 bits)
Internet Protocol Version 4, Src: 10.0.0.2, Dst: 10.0.0.1
Transmission Control Protocol, Src Port: 54321, Dst Port: 443, Seq: 179, Ack: 1181, Len: 6
Transport Layer Security
    TLSv1.2 Record Layer: Change Cipher Spec Protocol: Change Cipher Spec
        Content Type: Change Cipher Spec (20)
        Version: TLS 1.2 (0x0303)
        Length: 1
        Change Cipher Spec Message

Frame 11: 85 bytes on wire (680 bits), 85 bytes captured (680 bits)
Internet Protocol Version 4, Src: 10.0.0.2, Dst: 10.0.0.1
Transmission Control Protocol, Src Port: 54321, Dst Port: 443, Seq: 185, Ack: 1181, Len: 45
Transport Layer Security
    TLSv1.2 Record Layer: Handshake Protocol: Encrypted Handshake Message
        Content Type: Handshake (22)
        Version: TLS 1.2 (0x0303)
        Length: 40
        Handshake Protocol: Encrypted Handshake Message

Frame 12: 231 bytes on wire (1848 bits), 231 bytes captured (1848 bits)
Internet Protocol Version 4, Src: 10.0.0.1, Dst: 10.0.0.2
Transmission Control Protocol, Src Port: 443, Dst Port: 54321, Seq: 1181, Ack: 230, Len: 191
Transport Layer Security
    TLSv1.2 Record Layer: Handshake Protocol: New Session Ticket
        Content Type: Handshake (22)
        Version: TLS 1.2 (0x0303)
        Length: 186
        Handshake Protocol: New Session Ticket
            Handshake Type: New Session Ticket (4)
            Length: 182
            TLS Session Ticket
                Session Ticket Lifetime Hint: 7200 seconds (2 hours)
                Session Ticket Length: 176
                Session Ticket [truncated]: e06456f3a3d592e1b55c72b622b3022567afb37ffc0ff6ea44e7057e8f97050e6ce5808b6742d826228f105d91f005dbf5122ea1cc213809b9da693b92528b4c295655564be61f3ecbadc9779a755b8da0cb93a0c68c6d89772207d6a7d09617a4f5c70a96d893e46ce

Frame 13: 46 bytes on wire (368 bits), 46 bytes captured (368 bits)
Internet Protocol Version 4, Src: 10.0.0.1, Dst: 10.0.0.2
Transmission Control Protocol, Src Port: 443, Dst Port: 54321, Seq: 1372, Ack: 230, Len: 6
Transport Layer Security
    TLSv1.2 Record Layer: Change Cipher Spec Protocol: Change Cipher Spec
        Content Type: Change Cipher Spec (20)
        Version: TLS 1.2 (0x0303)
        Length: 1
        Change Cipher Spec Message

Frame 14: 85 bytes on wire (680 bits), 85 bytes captured (680 bits)
Internet Protocol Version 4, Src: 10.0.0.1, Dst: 10.0.0.2
Transmission Control Protocol, Src Port: 443, Dst Port: 54321, Seq: 1378, Ack: 230, Len: 45
Transport Layer Security
    TLSv1.2 Record Layer: Handshake Protocol: Encrypted Handshake Message
        Content Type: Handshake (22)
        Version: TLS 1.2 (0x0303)
        Length: 40
        Handshake Protocol: Encrypted Handshake Message

Frame 15: 103 bytes on wire (824 bits), 103 bytes captured (824 bits)
Internet Protocol Version 4, Src: 10.0.0.1, Dst: 10.0.0.2
Transmission Control Protocol, Src Port: 443, Dst Port: 54321, Seq: 1423, Ack: 230, Len: 63
Transport Layer Security
    TLSv1.2 Record Layer: Application Data Protocol: Hypertext Transfer Protocol
        Content Type: Application Data (23)
        Version: TLS 1.2 (0x0303)
        Length: 58
        Encrypted Application Data: 9c269a9f29810ab0a99141d1d84c3df5b3c6e328f879f64b2bcd6561fe7fe19a73edad45cd0fb968f4f0035dd4f7202b87c66b7a2f2442f6d53f
        [Application Data Protocol: Hypertext Transfer Protocol]

Frame 16: 119 bytes on wire (952 bits), 119 bytes captured (952 bits)
Internet Protocol Version 4, Src: 10.0.0.1, Dst: 10.0.0.2
Transmission Control Protocol, Src Port: 443, Dst Port: 54321, Seq: 1486, Ack: 230, Len: 79
Transport Layer Security
    TLSv1.2 Record Layer: Application Data Protocol: Hypertext Transfer Protocol
        Content Type: Application Data (23)
        Version: TLS 1.2 (0x0303)
        Length: 74
        Encrypted Application Data: 9c269a9f29810ab0a99141d1d84c3df4afcdf677d263f31a7a8f2c70ad62f69a72eaa943dd56e42cf9f1e436ba7d1eb5ee2efe9b65522edc686099935ebb98284af75a6253d1b5c10ec1
        [Application Data Protocol: Hypertext Transfer Protocol]

Frame 17: 117 bytes on wire (936 bits), 117 bytes captured (936 bits)
Internet Protocol Version 4, Src: 10.0.0.1, Dst: 10.0.0.2
Transmission Control Protocol, Src Port: 443, Dst Port: 54321, Seq: 1565, Ack: 230, Len: 77
Transport Layer Security
    TLSv1.2 Record Layer: Application Data Protocol: Hypertext Transfer Protocol
        Content Type: Application Data (23)
        Version: TLS 1.2 (0x0303)
        Length: 72
        Encrypted Application Data: 9c269a9f29810ab0a99141d1d84c3df6bfdcdb7dec7cf30462db203fbc36a29772edbf159643b468f5f1e520e7341daee867a49665542cd9b0d6e0ac2be205621f7ea4a034519f95
        [Application Data Protocol: Hypertext Transfer Protocol]

Frame 18: 109 bytes on wire (872 bits), 109 bytes captured (872 bits)
Internet Protocol Version 4, Src: 10.0.0.1, Dst: 10.0.0.2
Transmission Control Protocol, Src Port: 443, Dst Port: 54321, Seq: 1642, Ack: 230, Len: 69
Transport Layer Security
    TLSv1.2 Record Layer: Application Data Protocol: Hypertext Transfer Protocol
        Content Type: Application Data (23)
        Version: TLS 1.2 (0x0303)
        Length: 64
        Encrypted Application Data: 9c269a9f29810ab159fa2fa8e2b59bcfac98818ad5125321fca496d17d6a8d7b35dc795b9248e1a1156b47aa4654aa98a2197f30dea94e1565e1f28f540268ac
        [Application Data Protocol: Hypertext Transfer Protocol]

Frame 19: 40 bytes on wire (320 bits), 40 bytes captured (320 bits)
Internet Protocol Version 4, Src: 10.0.0.2, Dst: 10.0.0.1
Transmission Control Protocol, Src Port: 54321, Dst Port: 443, Seq: 230, Ack: 1711, Len: 0

